McNee Ranch to Planet of the Apes,McNee Ranch State Park,United States,Pacifica,California,25,2,37.5538,-122.512,7724.83,-842150451,-842150451,6144,2,2,1,368.808
Falls Trail to Back Creek Trail Loop,Mount Diablo State Park,United States,Clayton,California,18,2,37.9194,-121.942,15932.5,-842150451,-842150451,32,0,2,1,614.782
Brushy Peak South Loop with Tamcan Trail and Laughlin Loop Trail,Brushy Peak Regional Preserve,United States,Livermore,California,8,2,37.7469,-121.708,5149.89,-842150451,-842150451,6144,2,2,1,178.918
Shoreline Lake,Shoreline at Mountain View Park,United States,Mountain View,California,95,1,37.4323,-122.088,2253.08,-842150451,-842150451,2112,2,2,1,5.7912
East Ridge and Philips Loop,Redwood Regional Park,United States,Oakland,California,5,1,37.8317,-122.186,3540.55,-842150451,-842150451,6144,2,2,1,88.6968
Whittemore Gulch and Purisima Creek Loop Trail,Purisima Creek Redwoods Open Space Preserve,United States,Redwood City,California,500,2,37.4494,-122.339,15127.8,-842150451,-842150451,6480,0,2,2,666.902
Briones Crest Trail Loop,Briones Regional Park,United States,Orinda,California,10,2,37.9273,-122.158,12552.9,-842150451,-842150451,6464,2,2,1,485.851
Mount Sizer Loop,Henry W. Coe State Park,United States,Morgan Hill,California,60,3,37.1865,-121.547,23496.4,-842150451,-842150451,6208,0,2,1,1285.95
Palo Corona Trail,Carmel River State Beach,United States,Carmel-by-the-Sea,California,6,1,36.5324,-121.916,12070,-842150451,-842150451,2048,2,2,1,395.935
Chabot to Garin Regional Trail Cull Canyon Road Heyer Road Service Road Lake View Trail Columbia Drive,Cull Canyon Regional Recreation Area,United States,Castro Valley,California,26,1,37.71,-122.055,2896.81,-842150451,-842150451,6144,2,2,1,58.8264
John S Brooks Memorial Trail,Water Dog Lake Park,United States,Belmont,California,142,1,37.5082,-122.318,8690.44,-842150451,-842150451,2056,2,2,1,300.838
San Pablo Reservoir Road Biking Loop,San Pablo Reservoir,United States,Orinda,California,7,2,37.8995,-122.21,30094.7,-842150451,-842150451,6152,2,2,1,743.712
Thornewood Trail,Thornewood Open Space Preserve,United States,Woodside,California,15,1,37.3957,-122.256,2574.94,-842150451,-842150451,6400,2,1,1,43.8912
Mount Diablo Road Ride to Summit via South Gate,Mount Diablo State Park,United States,Danville,California,6,3,37.8226,-122.001,22691.7,-842150451,-842150451,2048,0,3,1,1078.99
Castle Rock Trail,Mount Diablo State Park,United States,Walnut Creek,California,147,2,37.8961,-121.996,9495.11,-842150451,-842150451,6208,2,2,1,307.848
Big Basin and Castle Rock Loop,Castle Rock State Park,United States,Saratoga,California,83,2,37.258,-122.121,11426.3,-842150451,-842150451,6480,0,2,1,353.873
Huckleberry Nature Path Trail,Huckleberry Botanic Preserve,United States,Canyon,California,161,1,37.8427,-122.195,3379.61,-842150451,-842150451,6464,2,2,1,115.824
Coffeeberry - Lower Ridge - Pine Loop,Jacks Peak County Park,United States,Carmel-by-the-Sea,California,22,1,36.5642,-121.874,6276.43,-842150451,-842150451,6208,2,2,1,229.819
Clyma Highland Ridge and Raven Loop,Morgan Territory Regional Preserve,United States,Brentwood,California,11,3,37.8185,-121.796,13518.5,-842150451,-842150451,2112,2,2,1,629.717
Terrace Trail,The Forest of Nisene Marks State Park,United States,Aptos,California,28,2,36.986,-121.905,4023.35,-842150451,-842150451,6480,2,2,1,149.962
Philips East Ridge Prince Stream Tres Sendas West Ridge Loop,Redwood Regional Park,United States,Oakland,California,7,2,37.8315,-122.185,7242.03,-842150451,-842150451,6144,0,2,1,253.898
Tafoni Loop,El Corte De Madera Creek Open Space Preserve,United States,Redwood Park,California,20,2,37.4119,-122.307,6115.49,-842150451,-842150451,2304,0,2,1,250.85
Brooks Falls Loop,San Pedro Valley County Park,United States,Pacifica,California,49,1,37.5781,-122.476,3540.55,-842150451,-842150451,6192,2,2,1,193.853
Black Hills and Whipsnake Loop Trail,Los Vaqueros Reservoir and Watershed,United States,Livermore,California,15,3,37.7732,-121.741,21243.3,-842150451,-842150451,2048,0,2,1,1092.71
Iris Trail and Rhus Trail,Jacks Peak County Park,United States,Monterey,California,21,1,36.564,-121.875,3057.75,-842150451,-842150451,6208,2,2,1,121.92
Fremont Peak and Valley View Loop Trail,Fremont Peak State Park,United States,San Juan Bautista,California,38,2,36.7601,-121.503,3862.42,-842150451,-842150451,6208,2,2,1,197.815
Dawn Falls and King Mountain Loop,King Mountain Open Space Preserve,United States,Larkspur,California,5,2,37.9309,-122.551,8851.37,-842150451,-842150451,6144,2,2,1,409.956
French Trail and Stream Trail Loop via Skyline Blvd,Redwood Regional Park,United States,Oakland,California,665,2,37.8314,-122.185,11265.4,-842150451,-842150451,6480,2,2,2,387.706
Garland E Garza East Ridge and Terrace Loop,Garland Ranch Regional Park,United States,Carmel Valley Village,California,8,2,36.4886,-121.75,5954.56,-842150451,-842150451,2048,2,2,1,424.891
Shadowbrook Trail,Big Basin Redwoods State Park,United States,Boulder Creek,California,14,1,37.1817,-122.211,6115.49,-842150451,-842150451,336,2,1,1,203.911
Javelina Loop Trail,Calero County Park,United States,Morgan Hill,California,22,2,37.1746,-121.761,11265.4,-842150451,-842150451,6216,2,2,1,435.864
York Trail,Leona Heights Park,United States,Oakland,California,54,2,37.7921,-122.18,3862.42,-842150451,-842150451,2336,2,1,1,206.959
East Shore Trail,Del Valle Regional Park,United States,Livermore,California,8,1,37.6195,-121.753,12231,-842150451,-842150451,72,2,2,1,429.768
 Redtail Loop Trail,Arastradero Preserve,United States,Palo Alto,California,21,1,37.3873,-122.174,1931.21,-842150451,-842150451,2048,2,2,1,39.9288
Big Basin to Sunset Camp via Sunset Trail,West Waddell Creek State Wilderness,United States,Boulder Creek,California,9,2,37.1726,-122.222,9334.17,-842150451,-842150451,2304,0,3,1,425.806
Alamo Briones to Mt. Diablo Regional Trail Stage Ravine and Little Yosemite Valley Loop ,Mount Diablo State Park,United States,Alamo,California,14,3,37.8706,-122.01,10460.7,-842150451,-842150451,2112,0,2,1,302.971
Anniversary Trail,Windy Hill Open Space,United States,Redwood City,California,23,1,37.3617,-122.247,1609.34,-842150451,-842150451,6208,2,2,1,32.9184
Dunn Trail and Monteiro Trail Loop,Redwood Regional Park,United States,Oakland,California,155,2,37.8034,-122.177,5471.76,-842150451,-842150451,6464,2,2,1,166.726
Rodeo Beach to Hill 88,Golden Gate National Recreation Area,United States,Sausalito,California,52,2,37.8323,-122.54,6115.49,-842150451,-842150451,6145,2,1,1,311.81
Philosopher's Way,John McLaren Park,United States,San Francisco,California,79,1,37.718,-122.421,3701.48,-842150451,-842150451,6144,2,2,1,109.728
Nimitz Way Trail,Tilden Regional Park,United States,Kensington,California,11,2,37.9055,-122.244,11587.2,-842150451,-842150451,6464,0,1,1,147.828
Harkins Ridge Trail to Craig Britton Trail to Purisima Creek Trail ,Purisima Creek Redwoods Open Space Preserve,United States,Half Moon Bay,California,79,3,37.4375,-122.371,12231,-842150451,-842150451,6480,0,2,1,506.882
Pleasanton Ridge to Shady Creek  to Bay Leaf Trail,Pleasanton Ridge Regional Park,United States,Verona,California,37,3,37.6148,-121.882,22530.8,-842150451,-842150451,6464,2,2,1,750.722
a,b,c,e,d,10,1,0,0,10,-842150451,-842150451,-842150451,-842150451,-842150451,-842150451,10
a,b,c,e,d,1,1,1,1,1,-842150451,-842150451,-842150451,-842150451,-842150451,-842150451,1
Berry Creek Falls Loop,West Waddell Creek State Wilderness,United States,Boulder Creek,California,740,3,37.1728,-122.223,14162.2,-842150451,-842150451,6512,0,2,2,676.961
b,c,d,f,e,10,1,0,0,10,-842150451,-842150451,-842150451,-842150451,-842150451,-842150451,10
Balconies Cave Trail,Pinnacles National Park,United States,Pinnacles,California,15,1,36.4921,-121.21,4184.28,-842150451,-842150451,2432,0,1,1,121.92
Camille Trail,Las Trampas Regional Park,United States,Alamo,California,7,2,37.8335,-122.025,3379.61,-842150451,-842150451,0,0,2,1,163.982
Little Yosemite and Indian Joe Creek Loop,Sunol Regional Wilderness,United States,Sunol,California,5,2,37.5098,-121.829,10299.8,-842150451,-842150451,6144,0,2,1,499.872
Spikes Peak Loop Trail,Pacheco State Park,United States,Hollister,California,24,2,37.0653,-121.211,11587.2,-842150451,-842150451,2048,0,2,1,376.733
High Meadow Loop via Coyote Trail,Rancho San Antonio County Park,United States,The Highlands,California,12,2,37.3313,-122.084,8690.44,-842150451,-842150451,320,2,2,1,251.765
Golden Gate Bridge from Baker Beach Trail,Presidio of San Francisco,United States,San Francisco,California,103,2,37.7924,-122.483,10138.8,-842150451,-842150451,2049,2,1,1,218.846
Carmel Beach,,United States,Carmel-by-the-Sea,California,10,1,36.5549,-121.93,2092.14,-842150451,-842150451,2113,2,1,1,32.9184
Mount Olympia to North Peak Loop,Mount Diablo State Park,United States,Clayton,California,14,3,37.9123,-121.885,14966.9,-842150451,-842150451,6144,0,2,1,1060.7
Sage Sky Garzas Canyon Mesa Waterfall Sycamore Lupine Loop,,United States,Carmel Valley Village,California,11,2,36.5096,-121.767,9173.24,-842150451,-842150451,6144,0,2,1,486.766
Los Cerritos Pena Figueroa Loop,Calero County Park,United States,Perry,California,6,2,37.1751,-121.761,8690.44,-842150451,-842150451,6144,2,2,1,243.84
North Peak Loop via Donner Canyon,Mount Diablo State Park,United States,Clayton,California,37,3,37.9221,-121.927,15610.6,-842150451,-842150451,6208,0,2,1,981.761
Mt. El Sombroso via Woods Trail,Sierra Azul Open Space Preserve,United States,New Almaden,California,29,2,37.1754,-121.864,18668.3,-842150451,-842150451,6208,0,1,1,640.994
Long Ridge Loop,Long Ridge Open Space Preserve,United States,La Honda,California,67,1,37.2902,-122.154,6920.16,-842150451,-842150451,6472,2,2,1,200.863
Coal Creek Trail,Coal Creek Open Space,United States,Los Altos,California,27,2,37.3312,-122.211,14966.9,-842150451,-842150451,6424,2,2,1,581.863
Twisted Forest Trail Loop,The Forest of Nisene Marks State Park,United States,Aptos,California,6,1,36.9857,-121.904,1448.41,-842150451,-842150451,6400,2,2,1,44.8056
Contra Loma Resevoir Ridge Trail,Contra Loma Regional Park,United States,Antioch,California,22,1,37.9712,-121.83,3379.61,-842150451,-842150451,6152,2,1,1,126.797
El Corte De Madera Trail Sampler Loop- El Corte Madera Creek Trail and Fir Trail ,El Corte De Madera Creek Open Space Preserve,United States,Redwood Park,California,5,2,37.4122,-122.307,16093.4,-842150451,-842150451,2304,0,2,1,701.954
Bay Area Ridge Trail: Santa Teresa County Park and Los Alamitos / Calero Creek Trail,Santa Teresa County Park,United States,San Jose,California,17,2,37.2124,-121.833,11587.2,-842150451,-842150451,0,2,2,1,195.986
Barbary Coast Trail ,,United States,San Francisco,California,27,2,37.7829,-122.407,6920.16,-842150451,-842150451,2048,2,3,1,78.9432
King Mountain Loop Trail,Golden Gate National Recreation Area,United States,Larkspur,California,79,2,37.9372,-122.539,5310.82,-842150451,-842150451,6464,2,2,1,218.846
Big Rock Hole Redwood Grove Ox Trail Path Loop,Henry Cowell Redwoods State Park,United States,Santa Cruz,California,23,2,37.0124,-122.054,10460.7,-842150451,-842150451,6416,0,2,1,454.762
Santa Cruz and Capitola Beach Ride,Wilder Ranch State Park,United States,Santa Cruz,California,6,3,36.975,-121.953,39428.8,-842150451,-842150451,2049,0,2,1,294.742
Miwok Trail,Round Valley Regional Preserve,United States,Los Vaqueros Reservoir & Watershed,California,9,2,37.8683,-121.75,11587.2,-842150451,-842150451,6352,2,1,1,175.87
South Marsh Loop Trail,Elkhorn Slough National Estuarine Research Reserve,United States,Moss Landing,California,29,1,36.8169,-121.73,5793.62,-842150451,-842150451,6224,2,2,1,75.8952
China Camp State Park Loop,China Camp State Park,United States,San Rafael,California,129,2,38.0089,-122.495,14323.1,-842150451,-842150451,6465,0,2,1,292.913
Fort Ord-Laguna Seca Trail,,United States,Salinas,California,38,2,36.5857,-121.713,9495.11,-842150451,-842150451,6208,2,2,1,221.894
East Ridge Prince Stream Tres Sendas French West Ridge,Redwood Regional Park,United States,Oakland,California,23,2,37.8314,-122.185,5471.76,-842150451,-842150451,2048,2,2,1,196.901
Rock City to the Summit of Mount Diablo,Mount Diablo State Park,United States,Danville,California,179,3,37.849,-121.933,12231,-842150451,-842150451,6464,0,1,1,670.865
Agua Caliente Trail,Ed R Levin County Park,United States,Milpitas,California,51,2,37.4575,-121.863,12713.8,-842150451,-842150451,6144,2,2,1,641.909
Grabtown Gulch to Purisima Creek Loop,Purisima Creek Redwoods Open Space Preserve,United States,Grabtown,California,71,2,37.4221,-122.337,8529.5,-842150451,-842150451,6464,0,2,1,389.839
Six Bridges Trail to Canyon Trail Loop,Butano State Park,United States,Pescadero,California,32,2,37.2082,-122.333,13035.7,-842150451,-842150451,6464,0,2,1,432.816
The Beach at Half Moon Bay,Half Moon Bay State Beach,United States,Half Moon Bay,California,6,1,37.4666,-122.446,6598.29,-842150451,-842150451,2113,2,1,1,32.9184
Bernal Heights Park Trail,Bernal Heights Park,United States,San Francisco,California,80,1,37.7421,-122.416,1609.34,-842150451,-842150451,2048,2,2,1,31.6992
Purisima Creek to Grabtown Gulch to Borden Hatch Mill Loop,Purisima Creek Redwoods Open Space Preserve,United States,Grabtown,California,19,2,37.4376,-122.371,9656.04,-842150451,-842150451,256,0,2,1,431.902
Sobrante Ridge Trail,Sobrante Ridge Regional Preserve,United States,El Sobrante,California,24,2,37.9795,-122.27,6598.29,-842150451,-842150451,6144,2,1,1,285.902
Huckleberry Hill Loop Trail,,United States,Monterey,California,42,2,36.5987,-121.913,3057.75,-842150451,-842150451,6208,2,2,1,168.859
Fort Mason,Fort Mason,United States,San Francisco,California,10,1,37.8053,-122.432,3379.61,-842150451,-842150451,2055,2,2,1,36.8808
Guadalupe Oak Grove Park,Guadalupe Oak Grove Park,United States,San Jose,California,8,1,37.2323,-121.878,6115.49,-842150451,-842150451,2048,2,2,1,61.8744
Rodeo Valley Trail To Miwok Trail Loop Via Coastal Trail,Golden Gate National Recreation Area,United States,Mill Valley,California,137,3,37.8339,-122.495,18185.5,-842150451,-842150451,6465,0,2,1,581.863
East Ridge and Stream Trail Loop ,Redwood Regional Park,United States,Oakland,California,37,2,37.8066,-122.148,10138.8,-842150451,-842150451,6464,2,2,1,275.844
English Camp Loop,Almaden Quicksilver County Park,United States,New Almaden,California,25,2,37.174,-121.825,5632.69,-842150451,-842150451,4112,2,2,1,277.978
San Pablo Ridge Trail,Wildcat Canyon Regional Park,United States,Richmond,California,52,3,37.952,-122.318,11265.4,-842150451,-842150451,2048,2,2,1,375.818
Stonewall Panoramic Trail to Viewpoint,Claremont Canyon Regional Preserve,United States,Oakland,California,22,2,37.8626,-122.244,3862.42,-842150451,-842150451,6144,2,1,1,255.727
Volvon and Blue Oak Loop Trail,Morgan Territory Regional Preserve,United States,Brentwood,California,19,2,37.8179,-121.796,11587.2,-842150451,-842150451,2048,2,2,1,370.942
Milagra Overlook Trail,Golden Gate National Recreation Area,United States,Pacifica,California,37,1,37.6355,-122.474,4345.22,-842150451,-842150451,6144,2,2,1,171.907
Fern Trail Spring Trail and Lookout Trail Loop,Pogonip Open Space Preserve,United States,Santa Cruz,California,55,1,36.9848,-122.039,7402.96,-842150451,-842150451,6464,2,2,1,200.863
Aquinas Trail,El Sereno Open Space Preserve,United States,Los Gatos,California,11,3,37.213,-122.023,12713.8,-842150451,-842150451,2368,2,1,1,523.951
Jackson Flats Trail,Butano State Park,United States,Pescadero,California,15,2,37.2019,-122.339,23013.6,-842150451,-842150451,256,0,2,1,904.951
Wilder Ridge and Zane Gray Cutoff Loop,Wilder Ranch State Park,United States,Santa Cruz,California,15,2,36.9601,-122.085,9977.91,-842150451,-842150451,6144,0,2,1,230.734
Tennesse Valley to Muir Beach and Fox Trail,Golden Gate National Recreation Area,United States,Tamalpais-Homestead Valley,California,35,3,37.8604,-122.536,10782.6,-842150451,-842150451,6145,0,2,1,508.711
Deep Gulch English Camp Castillero and Mine Hill Trail Loop,Almaden Quicksilver County Park,United States,New Almaden,California,11,3,37.174,-121.825,10621.6,-842150451,-842150451,2368,2,2,1,406.908
San Francisco Bay Trail: Foster City and San Mateo Bikeways,Shorebird Park,United States,San Mateo,California,71,1,37.5512,-122.252,16737.1,-842150451,-842150451,2049,2,3,1,31.6992
PG&E Wilcat Loop Lower Meadow Trail,Rancho San Antonio County Park,United States,The Highlands,California,13,2,37.3326,-122.087,6598.29,-842150451,-842150451,6144,0,2,1,183.794
Cape Horn Loop,Henry Cowell Redwoods State Park,United States,Felton,California,3,2,37.0497,-122.083,5632.69,-842150451,-842150451,6144,0,2,1,210.922
Stream Trail to Redwood Peak and West Ridge Trail,Redwood Regional Park,United States,Oakland,California,100,2,37.8069,-122.149,9656.04,-842150451,-842150451,6480,2,2,1,338.938
Ringtail Cat Trail to Madrone Trail Loop,Las Trampas Regional Park,United States,San Ramon,California,27,3,37.8369,-122.032,15127.8,-842150451,-842150451,2048,2,2,1,719.938
The Southern Beaches at San Gregorio State Beach,San Gregorio State Beach,United States,Half Moon Bay,California,9,1,37.3236,-122.401,4667.09,-842150451,-842150451,161,2,1,1,77.724
Cesar Chavez Park Trail,Cesar E  Chavez Park,United States,Berkeley,California,41,1,37.871,-122.315,2414.01,-842150451,-842150451,2049,2,2,1,6.7056
Sweeney Ridge Trail via Sneath Lane,Golden Gate National Recreation Area,United States,San Bruno,California,273,2,37.6191,-122.454,12391.9,-842150451,-842150451,6208,2,1,1,508.711
Howard King Trail,Big Basin Redwoods State Park,United States,Boulder Creek,California,33,2,37.1721,-122.222,16254.3,-842150451,-842150451,2304,0,1,1,754.99
San Juan Bautista De Anza Trail,,United States,San Juan Bautista,California,48,2,36.8353,-121.532,8368.57,-842150451,-842150451,6208,2,1,1,253.898
El Corte De Madera Loop- Tafoni Trail Methuselah Trail Gordon Mill Trail,El Corte De Madera Creek Open Space Preserve,United States,Adobe Corner,California,9,2,37.3997,-122.295,18346.5,-842150451,-842150451,6400,0,2,1,723.9
Iron Horse Regional Trail,,United States,Dublin,California,45,1,37.6756,-121.863,44578.7,-842150451,-842150451,6226,2,3,1,110.947
Rose Peak From Sunol,Sunol Regional Wilderness,United States,Sunol,California,32,3,37.5104,-121.828,30255.6,-842150451,-842150451,6464,2,1,1,1227.73
Harvey Bear Trail,Coyote Lake Harvey Bear Ranch County Park,United States,San Martin,California,104,1,37.0989,-121.576,7242.03,-842150451,-842150451,6400,2,2,1,214.884
Rockaway Point Trail,Pacifica State Beach,United States,Pacifica,California,21,1,37.5979,-122.502,2735.88,-842150451,-842150451,2049,2,2,1,66.7512
Almaden Lake,Almaden Lake Park,United States,San Jose,California,13,1,37.2415,-121.874,3057.75,-842150451,-842150451,8,2,1,1,10.9728
Rainbow Knoll and Hunter's Point via Seven Springs Loop,Fremont Older Open Space Preserve,United States,Saratoga,California,16,2,37.2861,-122.056,6598.29,-842150451,-842150451,2048,2,2,1,247.802
Murphy Meadow Trail Loop,Round Valley Regional Preserve,United States,Los Vaqueros Reservoir & Watershed,California,6,1,37.8683,-121.75,9173.24,-842150451,-842150451,6208,2,2,1,116.738
East Shore Ridgeline East Ridge Loop,Del Valle Regional Park,United States,Livermore,California,52,1,37.5866,-121.703,8368.57,-842150451,-842150451,4105,2,2,1,220.98
Butano Fire Trail Canyon Jackson Flats Doe Ridge and Little Butano Creek Trail Loop,Butano State Park,United States,Pescadero,California,4,3,37.2111,-122.332,26715,-842150451,-842150451,2304,0,2,1,943.966
Seven Springs Trail Loop,Fremont Older Open Space Preserve,United States,Cupertino,California,306,2,37.286,-122.055,4184.28,-842150451,-842150451,6208,2,2,2,170.993
Los Alamitos Creek Trail,,United States,San Jose,California,19,1,37.2016,-121.83,15771.5,-842150451,-842150451,2376,2,1,1,55.7784
Hacienda Randol and Buena Vista Trail Loop,Almaden Quicksilver County Park,United States,New Almaden,California,196,2,37.1934,-121.837,5793.62,-842150451,-842150451,6480,2,2,1,250.85
Tres Sendas Trail,Redwood Regional Park,United States,Oakland,California,9,2,37.8234,-122.187,2574.94,-842150451,-842150451,6400,2,1,1,154.838
Sweeney Ridge Trail via Mori Ridge,Golden Gate National Recreation Area,United States,Pacifica,California,119,2,37.6174,-122.483,7402.96,-842150451,-842150451,6208,2,1,1,330.708
Seal Rocks Beach,Golden Gate National Recreation Area,United States,San Francisco,California,7,2,37.7805,-122.511,3701.48,-842150451,-842150451,2049,2,1,1,118.872
Pine Mountain Trail,Big Basin Redwoods State Park,United States,Boulder Creek,California,12,2,37.1722,-122.222,6437.36,-842150451,-842150451,6464,2,1,1,372.77
Pulgas Water Temple Area Exploration,San Francisco Peninsula Watershed,United States,Redwood City,California,5,1,37.4833,-122.317,6598.29,-842150451,-842150451,4104,2,1,1,113.995
hellotest,a,b,d,c,1,1,1,1,1,-842150451,-842150451,7,3,2,3,1
Milagra Ridge Trail Loop,Golden Gate National Recreation Area,United States,Pacifica,California,6,1,37.6356,-122.474,2253.08,-842150451,-842150451,2112,2,2,1,73.7616
Oil Well Road Goat Trail Loop,Fort Ord National Monument,United States,Salinas,California,6,1,36.5834,-121.715,16576.2,-842150451,-842150451,6144,2,2,1,323.698
Lake Temescal Loop Trail,Temescal Regional Recreation Area,United States,Oakland,California,32,1,37.8441,-122.227,1609.34,-842150451,-842150451,6408,2,2,1,12.8016
Point Lobos South Shore Trail,Point Lobos State Natural Reserve,United States,Carmel-by-the-Sea,California,17,1,36.5096,-121.942,4023.35,-842150451,-842150451,6209,0,2,1,35.9664
Ridge Trail to Goat Rock Overlook Emily Smith Observation Point and Saratoga Gap Trail,Castle Rock State Park,United States,Saratoga,California,22,2,37.2304,-122.096,5954.56,-842150451,-842150451,2304,0,2,1,248.717
Penetencia Creek Trail to South Rim to Sycamore Switchback,Alum Rock Park,United States,San Jose,California,6,2,37.3971,-121.798,4828.02,-842150451,-842150451,6464,0,2,1,208.788
Walk Across the Golden Gate Bridge,Fort Point National Historic Site,United States,San Francisco,California,72,1,37.8074,-122.475,5954.56,-842150451,-842150451,2048,2,1,1,58.8264
West Ridge Ridge Connector and Loma Prieta Grade Loop,The Forest of Nisene Marks State Park,United States,Aptos,California,9,2,37.0006,-121.906,14484.1,-842150451,-842150451,2304,0,2,1,399.898
Mount Diablo North Peak Trail,Mount Diablo State Park,United States,Walnut Creek,California,125,3,37.8767,-121.931,10460.7,-842150451,-842150451,6400,0,1,1,582.778
Strawberry Canyon Fire Trail,Claremont Canyon Regional Preserve,United States,Berkeley,California,249,2,37.8725,-122.242,5954.56,-842150451,-842150451,2306,2,3,2,188.976
Alambique Redwood and Bear Gulch Loop,Wunderlich County Park,United States,Woodside,California,17,2,37.4106,-122.261,5149.89,-842150451,-842150451,6144,0,2,1,209.702
Dawn Falls Trail,Blithedale Summit Open Space Preserve,United States,Larkspur,California,6,1,37.9313,-122.551,3540.55,-842150451,-842150451,6496,2,1,1,111.862
Rodeo Valley Loop and Slacker Hill,Golden Gate National Recreation Area,United States,Sausalito,California,37,2,37.8338,-122.495,9656.04,-842150451,-842150451,2048,0,2,1,338.938
Manzanita County Park Trails,Manzanita Regional Park,United States,Salinas,California,16,2,36.7991,-121.682,5149.89,-842150451,-842150451,6208,2,2,1,113.995
Old Tree Trail,Portola Redwoods State Park,United States,La Honda,California,8,1,37.2527,-122.217,1448.41,-842150451,-842150451,4352,2,1,1,101.803
Lake Merritt,Lakeside Park,United States,Oakland,California,146,1,37.7989,-122.259,4988.95,-842150451,-842150451,8,2,2,1,13.716
Penitencia Creek Trail,Alum Rock Park,United States,San Jose,California,118,1,37.397,-121.798,5632.69,-842150451,-842150451,2136,2,1,1,79.8576
Dipsea Ridge & Tenderfoot Trail Loop,Old Mill Park,United States,Mill Valley,California,34,2,37.9052,-122.553,6759.23,-842150451,-842150451,0,2,2,1,197.815
Ridge Top Trail to Briones to Mount Diablo Recreational Trail Loop,Shell Ridge Open Space,United States,Walnut Creek,California,8,1,37.9018,-122.032,7242.03,-842150451,-842150451,6144,0,2,1,321.869
Sage and Madrone Loop Trail,Jacks Peak County Park,United States,Carmel-by-the-Sea,California,10,1,36.5626,-121.859,2414.01,-842150451,-842150451,6208,2,2,1,109.728
Squirrel Gulch Trail to Eagle Crest Trail to Ridgeline Trail Loop,Del Valle Regional Park,United States,Livermore,California,13,2,37.5867,-121.704,7724.83,-842150451,-842150451,2368,2,2,1,280.721
Coyote Peak and Ridge Trail Loop,Santa Teresa County Park,United States,San Jose,California,77,2,37.214,-121.786,6115.49,-842150451,-842150451,6208,2,2,1,214.884
Caswell Short Loop Trail,Caswell Memorial State Park,United States,Ripon,California,33,1,37.6942,-121.184,1931.21,-842150451,-842150451,6480,2,2,1,3.9624
Quail Loop Trail to Live Oak  Nature Trail,Junipero Serra County Park,United States,San Bruno,California,19,1,37.6098,-122.426,2574.94,-842150451,-842150451,2048,2,2,1,88.6968
Dunn Graham and West Ridge Trail Loop,Redwood Regional Park,United States,Oakland,California,270,2,37.8035,-122.177,6115.49,-842150451,-842150451,6464,2,2,2,180.746
Coyote Valley Trail,Coyote Valley Open Space Preserve,United States,Morgan Hill,California,47,2,37.1712,-121.728,6276.43,-842150451,-842150451,6144,0,2,1,190.805
Dias Ridge ,Mount Tamalpais State Park,United States,Sausalito,California,16,2,37.8849,-122.555,9173.24,-842150451,-842150451,6465,0,1,1,337.718
Vollmer Peak Trail and Lupine Trail Loop,Tilden Regional Park,United States,La Loma Park,California,7,2,37.8895,-122.234,4506.15,-842150451,-842150451,2304,2,2,1,258.775
Old Saint Hilarys and Uplands Preserve,Tiburon Uplands Nature Preserve,United States,Belvedere-Tiburon,California,10,2,37.8891,-122.449,1609.34,-842150451,-842150451,6144,2,2,1,128.93
Olive and Thermalito Trail Loop,Pleasanton Ridge Regional Park,United States,Sunol,California,41,2,37.6148,-121.883,6437.36,-842150451,-842150451,0,2,2,1,325.831
